{
  "$schema": "./skills-manifest.schema.json",
  "version": "1.0.1",
  "workspace": "bootlogix",
  "owner": "Muhammad Tayyab",
  "updated": "2026-04-16",
  "mcpServers": {
    "video-bridge": {
      "command": "python3",
      "entryPoint": "/home/muhammad_tayyab/bootlogix/mcp_bridge/server.py",
      "transport": "stdio",
      "env": {
        "BOOTLOGIX_WORKSPACE": "/home/muhammad_tayyab/bootlogix/production/output"
      },
      "capabilities": [
        "youtube_upload",
        "youtube_authenticate",
        "youtube_get_channel",
        "youtube_search",
        "youtube_download",
        "caption_transcribe",
        "caption_generate_ass",
        "render_burn_captions",
        "render_encode_frames",
        "render_linear_wipe",
        "render_convert_format",
        "topaz_upscale",
        "topaz_denoise",
        "quality_validate",
        "quality_report"
      ],
      "source": "local",
      "description": "Unified video production bridge — YouTube, captions, rendering, Topaz upscale, quality validation"
    },
    "youtube-shorts-transcript-extractor": {
      "command": "node",
      "entryPoint": "/home/muhammad_tayyab/bootlogix/.claude/skills/playwright-youtube-shorts/mcp-server/server.js",
      "cwd": "/home/muhammad_tayyab/bootlogix/.claude/skills/playwright-youtube-shorts",
      "transport": "stdio",
      "env": {
        "NODE_ENV": "production"
      },
      "capabilities": [
        "extract_youtube_shorts_transcript"
      ],
      "source": "local"
    }
  },
  "skills": {
    "ai-video-generation": {
      "name": "ai-video-generation",
      "description": "Generate AI videos with Google Veo, Seedance, Wan, Grok and 40+ models via inference.sh CLI. Supports text-to-video, image-to-video, avatar animation, lipsync, video upscaling, and foley sound.",
      "directory": ".claude/skills/ai-video-generation",
      "language": "bash",
      "mainFile": "SKILL.md",
      "triggers": [
        "video generation",
        "ai video",
        "text to video",
        "image to video",
        "veo",
        "animate image",
        "video from image",
        "ai animation",
        "video generator",
        "generate video",
        "t2v",
        "i2v",
        "ai video maker",
        "create video with ai",
        "runway alternative",
        "pika alternative",
        "sora alternative",
        "kling alternative"
      ],
      "tools": [
        "infsh (inference.sh CLI)"
      ],
      "dependencies": [
        "infsh CLI"
      ],
      "relatedSkills": [
        "elevenlabs-tts",
        "copywriting",
        "remotion"
      ],
      "allowedTools": [
        "Bash(infsh *)"
      ],
      "source": {
        "type": "github",
        "owner": "inferen-sh",
        "repo": "skills",
        "path": "ai-video-generation"
      }
    },
    "elevenlabs-tts": {
      "name": "elevenlabs-tts",
      "description": "ElevenLabs text-to-speech with 22+ premium voices, multilingual support, and voice tuning. Models: eleven_multilingual_v2, eleven_turbo_v2_5, eleven_flash_v2_5.",
      "directory": ".claude/skills/elevenlabs-tts",
      "language": "bash",
      "mainFile": "SKILL.md",
      "triggers": [
        "elevenlabs",
        "eleven labs",
        "elevenlabs tts",
        "premium tts",
        "professional voice",
        "ai voice",
        "high quality tts",
        "multilingual tts",
        "eleven labs voice",
        "voice generation",
        "natural speech",
        "realistic voice",
        "voice over",
        "speech synthesis"
      ],
      "tools": [
        "infsh (inference.sh CLI)"
      ],
      "dependencies": [
        "infsh CLI"
      ],
      "relatedSkills": [
        "ai-video-generation"
      ],
      "allowedTools": [
        "Bash(infsh *)"
      ],
      "source": {
        "type": "github",
        "owner": "inferen-sh",
        "repo": "skills",
        "path": "elevenlabs-tts"
      }
    },
    "copywriting": {
      "name": "copywriting",
      "description": "Expert conversion copywriting for marketing pages — homepage, landing pages, pricing pages, feature pages, about pages, and product pages. Drives action through clear, compelling copy.",
      "directory": ".claude/skills/copywriting",
      "language": "markdown",
      "mainFile": "SKILL.md",
      "triggers": [
        "write copy for",
        "improve this copy",
        "rewrite this page",
        "marketing copy",
        "headline help",
        "cta copy",
        "value proposition",
        "tagline",
        "subheadline",
        "hero section copy",
        "above the fold",
        "this copy is weak",
        "make this more compelling",
        "help me describe my product"
      ],
      "referenceFiles": [
        "references/natural-transitions.md",
        "references/copy-frameworks.md"
      ],
      "relatedSkills": [
        "ai-video-generation",
        "elevenlabs-tts"
      ],
      "source": {
        "type": "github",
        "owner": "coreyhaines31",
        "repo": "marketingskills",
        "path": "copywriting"
      }
    },
    "python-code-style": {
      "name": "python-code-style",
      "description": "Python code quality: ruff formatting/linting, mypy strict mode type checking, Google-style docstrings, naming conventions, 120-char line length. Python 3.12+.",
      "directory": ".agents/skills/python-code-style",
      "language": "markdown",
      "mainFile": "SKILL.md",
      "triggers": [
        "python",
        "python code style",
        "python linting",
        "python formatting",
        "ruff",
        "mypy",
        "docstring",
        "pep 8",
        "python naming"
      ],
      "relatedSkills": [
        "interview"
      ],
      "source": {
        "type": "local",
        "owner": "bootlogix",
        "repo": "workspace",
        "path": ".agents/skills/python-code-style"
      }
    },
    "remotion": {
      "name": "remotion",
      "description": "AI video production workflow using Remotion. Default workflow: Firecrawl brand scrape, create project, build scenes, start Remotion Studio, Cloudflare tunnel, user preview, render. Covers motion graphics principles, transcription overlays, type scale, tunnel management, and AI voiceover.",
      "directory": ".claude/skills/remotion",
      "language": "markdown",
      "mainFile": "SKILL.md",
      "referenceFiles": [
        "references/composition-patterns.md",
        "references/components.md",
        "scripts/remotion.sh",
        "scripts/firecrawl.sh"
      ],
      "triggers": [
        "remotion",
        "make a video",
        "video composition",
        "motion graphics",
        "animated video",
        "video editor",
        "create video with remotion"
      ],
      "relatedSkills": [
        "ai-video-generation",
        "elevenlabs-tts",
        "remotion-best-practices"
      ],
      "source": {
        "type": "github",
        "owner": "inferen-sh",
        "repo": "skills",
        "path": "remotion"
      }
    },
    "remotion-best-practices": {
      "name": "remotion-best-practices",
      "description": "37 Remotion rule files covering 3D, animations, assets, audio, audio-visualization, charts, compositions, display-captions, extract-frames, ffmpeg, fonts, gifs, images, lottie, maps, measuring-dom-nodes, measuring-text, sequencing, sfx, subtitles, tailwind, text-animations, timing, transitions, transparent-videos, trimming, videos, voiceover, and more.",
      "directory": ".agents/skills/remotion-best-practices",
      "language": "markdown",
      "mainFile": "SKILL.md",
      "triggers": [
        "remotion best practices",
        "remotion rules",
        "remotion animation",
        "remotion composition",
        "remotion captions",
        "remotion audio",
        "remotion video"
      ],
      "relatedSkills": [
        "remotion",
        "ai-video-generation"
      ],
      "source": {
        "type": "github",
        "owner": "remotion-dev",
        "repo": "skills",
        "path": "."
      }
    },
    "interview": {
      "name": "interview",
      "description": "Discovery conversation skill — surfaces the WHY behind the WHAT before building anything. Covers the WHY+WHAT model, laddering technique, 5 whys, assumption categories, anti-patterns, and confirmation patterns.",
      "directory": ".claude/skills/interview",
      "language": "markdown",
      "mainFile": "SKILL.md",
      "referenceFiles": [
        "references/question-patterns.md",
        "references/anti-patterns.md",
        "references/summary-templates.md"
      ],
      "triggers": [
        "interview",
        "discovery",
        "understand the problem",
        "why are we doing this",
        "what problem does this solve",
        "before building",
        "clarify requirements",
        "ask questions"
      ],
      "relatedSkills": [
        "copywriting"
      ],
      "source": {
        "type": "github",
        "owner": "inferen-sh",
        "repo": "skills",
        "path": "interview"
      }
    },
    "find-skills": {
      "name": "find-skills",
      "description": "Skill discovery guide — searches the open agent skills ecosystem, checks install count, source reputation, GitHub stars, presents options with install commands.",
      "directory": ".claude/skills/find-skills",
      "language": "markdown",
      "mainFile": "SKILL.md",
      "triggers": [
        "find a skill",
        "search skills",
        "is there a skill for",
        "how do i do x",
        "skills marketplace"
      ],
      "relatedSkills": [],
      "source": {
        "type": "github",
        "owner": "inferen-sh",
        "repo": "skills",
        "path": "find-skills"
      }
    },
    "maven-edit": {
      "name": "maven-edit",